{
  "$schema": "https://json-schema.org/draft/2020-12/schema",
  "$id": "https://company.md/schemas/0.1/artifact-receipt.schema.json",
  "title": "Company.md artifact receipt v1",
  "type": "object",
  "required": [
    "schema",
    "generatedAt",
    "profile",
    "clearance",
    "deliverable",
    "sources",
    "clientSources",
    "unresolved"
  ],
  "properties": {
    "schema": { "const": "companymd/receipt/v1" },
    "contract": {
      "enum": ["generic/v1", "presentation/v1"]
    },
    "generatedAt": { "type": "string", "format": "date-time" },
    "profile": {
      "enum": ["core", "customer", "commercial", "communications", "visual", "all"]
    },
    "clearance": {
      "enum": ["public", "internal", "confidential", "restricted"]
    },
    "completion": {
      "enum": ["complete", "failed", "blocked", "incomplete"]
    },
    "deliverable": {
      "oneOf": [
        { "$ref": "#/$defs/deliverableRecord" },
        { "$ref": "#/$defs/remoteDeliverableRecord" }
      ]
    },
    "sources": {
      "type": "array",
      "items": { "$ref": "#/$defs/fileRecord" }
    },
    "intermediates": {
      "type": "array",
      "items": { "$ref": "#/$defs/fileRecord" }
    },
    "clientSources": {
      "type": "array",
      "items": { "type": "string", "minLength": 1 }
    },
    "unresolved": {
      "type": "array",
      "items": { "type": "string", "minLength": 1 }
    },
    "verification": {
      "type": "array",
      "items": {
        "type": "object",
        "required": ["id", "status"],
        "properties": {
          "id": {
            "type": "string",
            "pattern": "^[a-z0-9][a-z0-9._/-]{0,127}$"
          },
          "status": {
            "enum": ["pass", "fail", "blocked", "not-run"]
          },
          "note": {
            "type": "string",
            "minLength": 1
          }
        },
        "additionalProperties": false
      }
    }
  },
  "dependentRequired": {
    "completion": ["verification"],
    "verification": ["completion"]
  },
  "allOf": [
    {
      "if": { "required": ["contract"] },
      "then": {
        "required": ["completion", "verification"],
        "properties": {
          "verification": { "minItems": 1 }
        }
      }
    },
    {
      "if": {
        "properties": {
          "deliverable": {
            "required": ["exists"],
            "properties": { "exists": { "const": false } }
          }
        }
      },
      "then": {
        "required": ["completion", "verification"],
        "properties": {
          "completion": { "enum": ["failed", "blocked"] },
          "verification": {
            "contains": {
              "properties": { "status": { "enum": ["fail", "blocked"] } },
              "required": ["status"]
            }
          }
        }
      }
    },
    {
      "if": {
        "required": ["completion"],
        "properties": { "completion": { "const": "complete" } }
      },
      "then": {
        "properties": {
          "deliverable": {
            "oneOf": [
              {
                "required": ["exists"],
                "properties": { "exists": { "const": true } }
              },
              { "$ref": "#/$defs/remoteDeliverableRecord" }
            ]
          },
          "verification": {
            "minItems": 1,
            "items": {
              "properties": { "status": { "const": "pass" } },
              "required": ["status"]
            }
          }
        }
      }
    },
    {
      "if": {
        "properties": {
          "deliverable": {
            "required": ["kind"],
            "properties": { "kind": { "const": "remote" } }
          }
        }
      },
      "then": {
        "required": ["completion", "verification"],
        "properties": {
          "verification": {
            "allOf": [
              {
                "contains": {
                  "required": ["id"],
                  "properties": { "id": { "const": "artifact/access" } }
                }
              },
              {
                "contains": {
                  "required": ["id"],
                  "properties": { "id": { "const": "artifact/revision" } }
                }
              }
            ]
          }
        }
      }
    },
    {
      "if": {
        "required": ["contract"],
        "properties": { "contract": { "const": "presentation/v1" } }
      },
      "then": {
        "properties": {
          "profile": { "const": "visual" },
          "verification": {
            "allOf": [
              {
                "contains": {
                  "required": ["id"],
                  "properties": { "id": { "const": "artifact/export" } }
                }
              },
              {
                "contains": {
                  "required": ["id"],
                  "properties": { "id": { "const": "artifact/render" } }
                }
              },
              {
                "contains": {
                  "required": ["id"],
                  "properties": { "id": { "const": "artifact/overflow" } }
                }
              },
              {
                "contains": {
                  "required": ["id"],
                  "properties": { "id": { "const": "design/conformance" } }
                }
              }
            ]
          }
        }
      }
    }
  ],
  "$defs": {
    "deliverableRecord": {
      "type": "object",
      "required": ["path", "exists", "sha256"],
      "properties": {
        "path": { "type": "string", "minLength": 1 },
        "exists": { "type": "boolean" },
        "sha256": {
          "oneOf": [
            { "type": "string", "pattern": "^[a-f0-9]{64}$" },
            { "type": "null" }
          ]
        }
      },
      "oneOf": [
        {
          "properties": {
            "exists": { "const": true },
            "sha256": { "type": "string", "pattern": "^[a-f0-9]{64}$" }
          }
        },
        {
          "required": ["exists"],
          "properties": {
            "exists": { "const": false },
            "sha256": { "type": "null" }
          }
        }
      ],
      "additionalProperties": false
    },
    "fileRecord": {
      "type": "object",
      "required": ["path", "exists", "sha256"],
      "properties": {
        "path": { "type": "string", "minLength": 1 },
        "exists": { "const": true },
        "sha256": { "type": "string", "pattern": "^[a-f0-9]{64}$" }
      },
      "additionalProperties": false
    },
    "remoteDeliverableRecord": {
      "type": "object",
      "required": ["kind", "url", "provider", "revisionId", "mimeType"],
      "properties": {
        "kind": { "const": "remote" },
        "url": { "type": "string", "format": "uri", "pattern": "^https://" },
        "provider": {
          "type": "string",
          "pattern": "^[a-z0-9][a-z0-9._-]{0,63}$"
        },
        "revisionId": { "type": "string", "minLength": 1 },
        "mimeType": {
          "type": "string",
          "pattern": "^[A-Za-z0-9!#$&^_.+-]+/[A-Za-z0-9!#$&^_.+-]+$"
        },
        "title": { "type": "string", "minLength": 1 },
        "export": {
          "type": "object",
          "required": ["mimeType", "size"],
          "properties": {
            "mimeType": {
              "type": "string",
              "pattern": "^[A-Za-z0-9!#$&^_.+-]+/[A-Za-z0-9!#$&^_.+-]+$"
            },
            "size": { "type": "integer", "minimum": 1 },
            "sha256": {
              "oneOf": [
                { "type": "string", "pattern": "^[a-f0-9]{64}$" },
                { "type": "null" }
              ]
            }
          },
          "additionalProperties": false
        }
      },
      "additionalProperties": false
    }
  },
  "additionalProperties": true
}
